"US should use chip leadership to enforce AI standards, says Mustafa Suleyman",https://www.ft.com/content/f828fef3-862c-4022-99d0-41efbc73db80,"Gain a global perspective on the US and go beyond with curated news and analysis from 600 journalists in 50+ countries covering politics, business, innovation, trends and more.",,,
How Do the White House’s A.I. Commitments Stack Up?,https://www.nytimes.com/2023/07/22/technology/ai-regulation-white-house.html,"This week, the White House announced that it had secured “voluntary commitments” from seven leading A.I. companies to manage the risks posed by artificial intelligence.",,,
Qualcomm banks on AI to get a bigger share of the automotive chip market,https://www.cnbc.com/2023/08/31/qualcomm-banks-on-ai-to-grow-automotive-chip-business.html,"Qualcomm is best known for the chips and modems inside Android phones. But in recent years, it's also started selling a package of hardware chips, sensors and software called Snapdragon Digital Chassis to automakers like GM, Hyundai and Volvo.",,,
US curbs AI chip exports from Nvidia and AMD to some Middle East countries,https://www.reuters.com/technology/us-restricts-exports-some-nvidia-chips-middle-east-countries-filing-2023-08-30/,Aug 30 (Reuters) - The U.S. expanded the restriction of exports of sophisticated Nvidia (NVDA.O) and Advanced Micro Devices (AMD.O) artificial-intelligence chips beyond China to other regions including some countries in the Middle East.,,,
"AI-powered BeFake is a real app, not a BeReal parody…and it has $3M in funding",https://techcrunch.com/2023/08/31/ai-powered-befake-is-a-real-app-not-a-bereal-parody-and-it-has-3m-in-funding/,"BeFake, a social networking app that combines concepts from popular Gen Z app BeReal along with AI technology has netted itself $3 million in seed funding to create an AI-augmented social network.",,,
OpenAI angles to put ChatGPT in classrooms with special tutor prompts,https://techcrunch.com/2023/08/31/openai-angles-to-put-chatgpt-in-classrooms-with-special-tutor-prompts/,"OpenAI wants its conversational AI agent ChatGPT everywhere, and that includes classrooms — despite the immense potential for misuse and confusion there.",,,
Websites That Have Blocked OpenAI’s GPTBot - 1000 Website Study,https://originality.ai/blog/study-websites-blocking-gptbot,We analyzed the top 1000 websites in the world to identify which sites are already blocking GPTBot. This study analyzes how they are responding.,,,
"Google introduces generative AI to Search in India, Japan",https://www.reuters.com/technology/google-introduces-generative-ai-search-india-japan-2023-08-31/,"Google logo and AI Artificial Intelligence words are seen in this illustration taken, May 4, 2023. REUTERS/Dado Ruvic/Illustration/file photo Acquire Licensing Rights Aug 30 (Reuters) - Alphabet's (GOOGL.",,,
AI helps ID cancer risk factors,https://www.sciencedaily.com/releases/2023/08/230831121757.htm,A novel study from the University of South Australia has identified a range of metabolic biomarkers that could help predict the risk of cancer.,,,
New AI technology gives robot recognition skills a big lift,https://www.sciencedaily.com/releases/2023/08/230831121804.htm,"A robot moves a toy package of butter around a table in the Intelligent Robotics and Vision Lab at The University of Texas at Dallas. With every push, the robot is learning to recognize the object through a new system developed by a team of UT Dallas computer scientists.",,,
People hold smart AI assistants responsible for outcomes,https://www.sciencedaily.com/releases/2023/08/230830131850.htm,"Even when humans see AI-based assistants purely as tools, they ascribe partial responsibility for decisions to them, as a new study shows. Future AI-based systems may navigate autonomous vehicles through traffic with no human input.",,,
Surpassing the human eye: Machine learning image analysis rapidly determines chemical mixture composition,https://www.sciencedaily.com/releases/2023/08/230830131922.htm,"Machine learning model provides quick method for determining the composition of solid chemical mixtures using only photographs of the sample. Have you ever accidentally ruined a recipe in the kitchen by adding salt instead of sugar? Due to their similar appearance, it's an easy mistake to make.",,,
OpenAI's business model starts to take shape,https://www.supervised.news/p/openais-business-model-starts-to,OpenAI in the past week or so has started to make its business model a little clearer as it starts to take shape as a tiered pricing structure with increasing premium performance and accessibility. With the release of fine-tuning for GPT 3.,,,